{"componentChunkName":"component---src-templates-article-tsx","path":"/arduino-thermostat/","result":{"data":{"mdx":{"body":"var _excluded = [\"components\"];\n\nfunction _extends() { _extends = Object.assign ? Object.assign.bind() : function (target) { for (var i = 1; i < arguments.length; i++) { var source = arguments[i]; for (var key in source) { if (Object.prototype.hasOwnProperty.call(source, key)) { target[key] = source[key]; } } } return target; }; return _extends.apply(this, arguments); }\n\nfunction _objectWithoutProperties(source, excluded) { if (source == null) return {}; var target = _objectWithoutPropertiesLoose(source, excluded); var key, i; if (Object.getOwnPropertySymbols) { var sourceSymbolKeys = Object.getOwnPropertySymbols(source); for (i = 0; i < sourceSymbolKeys.length; i++) { key = sourceSymbolKeys[i]; if (excluded.indexOf(key) >= 0) continue; if (!Object.prototype.propertyIsEnumerable.call(source, key)) continue; target[key] = source[key]; } } return target; }\n\nfunction _objectWithoutPropertiesLoose(source, excluded) { if (source == null) return {}; var target = {}; var sourceKeys = Object.keys(source); var key, i; for (i = 0; i < sourceKeys.length; i++) { key = sourceKeys[i]; if (excluded.indexOf(key) >= 0) continue; target[key] = source[key]; } return target; }\n\n/* @jsxRuntime classic */\n\n/* @jsx mdx */\nvar _frontmatter = {\n  \"date\": \"2021-02-06T23:26:12.000Z\",\n  \"description\": \"Build your own programmable thermostat with Arduino\",\n  \"tags\": [\"arduino-uno\", \"arduino-lcd-16x2\", \"relays\"],\n  \"title\": \"Arduino Thermostat\"\n};\nvar layoutProps = {\n  _frontmatter: _frontmatter\n};\nvar MDXLayout = \"wrapper\";\nreturn function MDXContent(_ref) {\n  var components = _ref.components,\n      props = _objectWithoutProperties(_ref, _excluded);\n\n  return mdx(MDXLayout, _extends({}, layoutProps, props, {\n    components: components,\n    mdxType: \"MDXLayout\"\n  }), mdx(\"h1\", null, \"Arduino Thermostat\"), mdx(\"p\", null, \"This \", mdx(\"a\", {\n    parentName: \"p\",\n    \"href\": \"../arduino-uno/\"\n  }, \"Arduino Uno\"), \" based thermostat provides an \", mdx(\"a\", {\n    parentName: \"p\",\n    \"href\": \"../arduino-lcd-16x2/\"\n  }, \"LCD Display\"), \" of current and target temperature, plus temperature control and measure toggle (fahrenheit/celsius) through toggle switches.\"), mdx(\"p\", null, \"It works by activating one relay when the temperature is too low, and another relay when the temperature is too high. When building the project, use LEDs in place of the relays for easy testing.\"), mdx(\"h2\", null, \"Thermostat Parts\"), mdx(\"table\", null, mdx(\"thead\", {\n    parentName: \"table\"\n  }, mdx(\"tr\", {\n    parentName: \"thead\"\n  }, mdx(\"th\", {\n    parentName: \"tr\",\n    \"align\": null\n  }, \"Part\"), mdx(\"th\", {\n    parentName: \"tr\",\n    \"align\": \"right\"\n  }, \"Quantity\"))), mdx(\"tbody\", {\n    parentName: \"table\"\n  }, mdx(\"tr\", {\n    parentName: \"tbody\"\n  }, mdx(\"td\", {\n    parentName: \"tr\",\n    \"align\": null\n  }, mdx(\"a\", {\n    parentName: \"td\",\n    \"href\": \"../arduino-uno/\"\n  }, \"Arduino Uno\")), mdx(\"td\", {\n    parentName: \"tr\",\n    \"align\": \"right\"\n  }, \"1\")), mdx(\"tr\", {\n    parentName: \"tbody\"\n  }, mdx(\"td\", {\n    parentName: \"tr\",\n    \"align\": null\n  }, \"Breadboard\"), mdx(\"td\", {\n    parentName: \"tr\",\n    \"align\": \"right\"\n  }, \"1\")), mdx(\"tr\", {\n    parentName: \"tbody\"\n  }, mdx(\"td\", {\n    parentName: \"tr\",\n    \"align\": null\n  }, \"16x2 LCD\"), mdx(\"td\", {\n    parentName: \"tr\",\n    \"align\": \"right\"\n  }, \"1\")), mdx(\"tr\", {\n    parentName: \"tbody\"\n  }, mdx(\"td\", {\n    parentName: \"tr\",\n    \"align\": null\n  }, \"Potentiometer\"), mdx(\"td\", {\n    parentName: \"tr\",\n    \"align\": \"right\"\n  }, \"1\")), mdx(\"tr\", {\n    parentName: \"tbody\"\n  }, mdx(\"td\", {\n    parentName: \"tr\",\n    \"align\": null\n  }, \"Momentary switches\"), mdx(\"td\", {\n    parentName: \"tr\",\n    \"align\": \"right\"\n  }, \"3\")), mdx(\"tr\", {\n    parentName: \"tbody\"\n  }, mdx(\"td\", {\n    parentName: \"tr\",\n    \"align\": null\n  }, \"10k \\u03A9 resistors\"), mdx(\"td\", {\n    parentName: \"tr\",\n    \"align\": \"right\"\n  }, \"3\")), mdx(\"tr\", {\n    parentName: \"tbody\"\n  }, mdx(\"td\", {\n    parentName: \"tr\",\n    \"align\": null\n  }, \"5V Relays\"), mdx(\"td\", {\n    parentName: \"tr\",\n    \"align\": \"right\"\n  }, \"2\")), mdx(\"tr\", {\n    parentName: \"tbody\"\n  }, mdx(\"td\", {\n    parentName: \"tr\",\n    \"align\": null\n  }, \"DHT11 temperature & humidity sensor\"), mdx(\"td\", {\n    parentName: \"tr\",\n    \"align\": \"right\"\n  }, \"1\")), mdx(\"tr\", {\n    parentName: \"tbody\"\n  }, mdx(\"td\", {\n    parentName: \"tr\",\n    \"align\": null\n  }, \"Jumper wires\"), mdx(\"td\", {\n    parentName: \"tr\",\n    \"align\": \"right\"\n  }, \"Several\")))), mdx(\"h2\", null, \"Hardware Build\"), mdx(\"p\", null, \"The instructions will be confusing if you do not reference the following wiring diagram!\"), mdx(\"p\", null, mdx(\"img\", {\n    parentName: \"p\",\n    \"src\": \"../img/arduino-thermostat-wiring-diagram.png\",\n    \"alt\": \"wiring diagram\"\n  })), mdx(\"h3\", null, \"1. Connect the LCD to the breadboard\"), mdx(\"p\", null, \"Note, some of the pin designations may differ between brands.\"), mdx(\"table\", null, mdx(\"thead\", {\n    parentName: \"table\"\n  }, mdx(\"tr\", {\n    parentName: \"thead\"\n  }, mdx(\"th\", {\n    parentName: \"tr\",\n    \"align\": null\n  }, \"LCD Pin\"), mdx(\"th\", {\n    parentName: \"tr\",\n    \"align\": null\n  }, \"Destination\"))), mdx(\"tbody\", {\n    parentName: \"table\"\n  }, mdx(\"tr\", {\n    parentName: \"tbody\"\n  }, mdx(\"td\", {\n    parentName: \"tr\",\n    \"align\": null\n  }, mdx(\"code\", {\n    parentName: \"td\",\n    \"className\": \"language-text\"\n  }, \"VSS\")), mdx(\"td\", {\n    parentName: \"tr\",\n    \"align\": null\n  }, \"Breadboard ground rail (\", mdx(\"code\", {\n    parentName: \"td\",\n    \"className\": \"language-text\"\n  }, \"-\"), \")\")), mdx(\"tr\", {\n    parentName: \"tbody\"\n  }, mdx(\"td\", {\n    parentName: \"tr\",\n    \"align\": null\n  }, mdx(\"code\", {\n    parentName: \"td\",\n    \"className\": \"language-text\"\n  }, \"VDD\")), mdx(\"td\", {\n    parentName: \"tr\",\n    \"align\": null\n  }, \"Breadboard power rail (\", mdx(\"code\", {\n    parentName: \"td\",\n    \"className\": \"language-text\"\n  }, \"+\"), \")\")), mdx(\"tr\", {\n    parentName: \"tbody\"\n  }, mdx(\"td\", {\n    parentName: \"tr\",\n    \"align\": null\n  }, mdx(\"code\", {\n    parentName: \"td\",\n    \"className\": \"language-text\"\n  }, \"VO\")), mdx(\"td\", {\n    parentName: \"tr\",\n    \"align\": null\n  }, \"Potentiometer wiper (middle pin)\")), mdx(\"tr\", {\n    parentName: \"tbody\"\n  }, mdx(\"td\", {\n    parentName: \"tr\",\n    \"align\": null\n  }, mdx(\"code\", {\n    parentName: \"td\",\n    \"className\": \"language-text\"\n  }, \"RS\")), mdx(\"td\", {\n    parentName: \"tr\",\n    \"align\": null\n  }, \"Arduino pin \", mdx(\"code\", {\n    parentName: \"td\",\n    \"className\": \"language-text\"\n  }, \"11\"))), mdx(\"tr\", {\n    parentName: \"tbody\"\n  }, mdx(\"td\", {\n    parentName: \"tr\",\n    \"align\": null\n  }, mdx(\"code\", {\n    parentName: \"td\",\n    \"className\": \"language-text\"\n  }, \"RW\")), mdx(\"td\", {\n    parentName: \"tr\",\n    \"align\": null\n  }, \"Ground rail (\", mdx(\"code\", {\n    parentName: \"td\",\n    \"className\": \"language-text\"\n  }, \"-\"), \")\")), mdx(\"tr\", {\n    parentName: \"tbody\"\n  }, mdx(\"td\", {\n    parentName: \"tr\",\n    \"align\": null\n  }, mdx(\"code\", {\n    parentName: \"td\",\n    \"className\": \"language-text\"\n  }, \"E\")), mdx(\"td\", {\n    parentName: \"tr\",\n    \"align\": null\n  }, \"Arduino pin \", mdx(\"code\", {\n    parentName: \"td\",\n    \"className\": \"language-text\"\n  }, \"12\"))), mdx(\"tr\", {\n    parentName: \"tbody\"\n  }, mdx(\"td\", {\n    parentName: \"tr\",\n    \"align\": null\n  }, mdx(\"code\", {\n    parentName: \"td\",\n    \"className\": \"language-text\"\n  }, \"D4\"), \" (sometimes \", mdx(\"code\", {\n    parentName: \"td\",\n    \"className\": \"language-text\"\n  }, \"DB4\"), \")\"), mdx(\"td\", {\n    parentName: \"tr\",\n    \"align\": null\n  }, \"Arduino pin \", mdx(\"code\", {\n    parentName: \"td\",\n    \"className\": \"language-text\"\n  }, \"2\"))), mdx(\"tr\", {\n    parentName: \"tbody\"\n  }, mdx(\"td\", {\n    parentName: \"tr\",\n    \"align\": null\n  }, mdx(\"code\", {\n    parentName: \"td\",\n    \"className\": \"language-text\"\n  }, \"D5\"), \" (sometimes \", mdx(\"code\", {\n    parentName: \"td\",\n    \"className\": \"language-text\"\n  }, \"DB5\"), \")\"), mdx(\"td\", {\n    parentName: \"tr\",\n    \"align\": null\n  }, \"Arduino pin \", mdx(\"code\", {\n    parentName: \"td\",\n    \"className\": \"language-text\"\n  }, \"3\"))), mdx(\"tr\", {\n    parentName: \"tbody\"\n  }, mdx(\"td\", {\n    parentName: \"tr\",\n    \"align\": null\n  }, mdx(\"code\", {\n    parentName: \"td\",\n    \"className\": \"language-text\"\n  }, \"D6\"), \" (sometimes \", mdx(\"code\", {\n    parentName: \"td\",\n    \"className\": \"language-text\"\n  }, \"DB6\"), \")\"), mdx(\"td\", {\n    parentName: \"tr\",\n    \"align\": null\n  }, \"Arduino pin \", mdx(\"code\", {\n    parentName: \"td\",\n    \"className\": \"language-text\"\n  }, \"4\"))), mdx(\"tr\", {\n    parentName: \"tbody\"\n  }, mdx(\"td\", {\n    parentName: \"tr\",\n    \"align\": null\n  }, mdx(\"code\", {\n    parentName: \"td\",\n    \"className\": \"language-text\"\n  }, \"D7\"), \" (sometimes \", mdx(\"code\", {\n    parentName: \"td\",\n    \"className\": \"language-text\"\n  }, \"DB7\"), \")\"), mdx(\"td\", {\n    parentName: \"tr\",\n    \"align\": null\n  }, \"Arduino pin \", mdx(\"code\", {\n    parentName: \"td\",\n    \"className\": \"language-text\"\n  }, \"5\"))), mdx(\"tr\", {\n    parentName: \"tbody\"\n  }, mdx(\"td\", {\n    parentName: \"tr\",\n    \"align\": null\n  }, mdx(\"code\", {\n    parentName: \"td\",\n    \"className\": \"language-text\"\n  }, \"A\"), \" (sometimes \", mdx(\"code\", {\n    parentName: \"td\",\n    \"className\": \"language-text\"\n  }, \"LED+\"), \")\"), mdx(\"td\", {\n    parentName: \"tr\",\n    \"align\": null\n  }, \"Breadboard power rail (\", mdx(\"code\", {\n    parentName: \"td\",\n    \"className\": \"language-text\"\n  }, \"+\"), \")\")), mdx(\"tr\", {\n    parentName: \"tbody\"\n  }, mdx(\"td\", {\n    parentName: \"tr\",\n    \"align\": null\n  }, mdx(\"code\", {\n    parentName: \"td\",\n    \"className\": \"language-text\"\n  }, \"K\"), \" (sometimes \", mdx(\"code\", {\n    parentName: \"td\",\n    \"className\": \"language-text\"\n  }, \"LED-\"), \")\"), mdx(\"td\", {\n    parentName: \"tr\",\n    \"align\": null\n  }, \"Breadboard ground rail (\", mdx(\"code\", {\n    parentName: \"td\",\n    \"className\": \"language-text\"\n  }, \"-\"), \")\")))), mdx(\"h3\", null, \"2. Connect the potentiometer\"), mdx(\"p\", null, \"Seat the potentiometer in the breadboard. Connect outer pins of the potentiometer to the power and ground rails of the breadboard. The wiper pin (in the middle) will connect to the LED \", mdx(\"code\", {\n    parentName: \"p\",\n    \"className\": \"language-text\"\n  }, \"VO\"), \" pin.\"), mdx(\"h3\", null, \"3. Connect the momentary switches\"), mdx(\"p\", null, \"Seat each momentary switch in the breadboard, then connect one pin of each switch to the breadboard power rail (\", mdx(\"code\", {\n    parentName: \"p\",\n    \"className\": \"language-text\"\n  }, \"+\"), \") and the other to the breadboard ground rail (\", mdx(\"code\", {\n    parentName: \"p\",\n    \"className\": \"language-text\"\n  }, \"-\"), \") with a 10K \\u03A9 resistor. Finally, connect each ground pin to the Arduino according to its purpose:\"), mdx(\"table\", null, mdx(\"thead\", {\n    parentName: \"table\"\n  }, mdx(\"tr\", {\n    parentName: \"thead\"\n  }, mdx(\"th\", {\n    parentName: \"tr\",\n    \"align\": null\n  }, \"Purpose\"), mdx(\"th\", {\n    parentName: \"tr\",\n    \"align\": null\n  }, \"Arduino Pin\"))), mdx(\"tbody\", {\n    parentName: \"table\"\n  }, mdx(\"tr\", {\n    parentName: \"tbody\"\n  }, mdx(\"td\", {\n    parentName: \"tr\",\n    \"align\": null\n  }, \"Temperature up\"), mdx(\"td\", {\n    parentName: \"tr\",\n    \"align\": null\n  }, mdx(\"code\", {\n    parentName: \"td\",\n    \"className\": \"language-text\"\n  }, \"7\"))), mdx(\"tr\", {\n    parentName: \"tbody\"\n  }, mdx(\"td\", {\n    parentName: \"tr\",\n    \"align\": null\n  }, \"Toggle celsius/fahrenheit\"), mdx(\"td\", {\n    parentName: \"tr\",\n    \"align\": null\n  }, mdx(\"code\", {\n    parentName: \"td\",\n    \"className\": \"language-text\"\n  }, \"8\"))), mdx(\"tr\", {\n    parentName: \"tbody\"\n  }, mdx(\"td\", {\n    parentName: \"tr\",\n    \"align\": null\n  }, \"Temperature down\"), mdx(\"td\", {\n    parentName: \"tr\",\n    \"align\": null\n  }, mdx(\"code\", {\n    parentName: \"td\",\n    \"className\": \"language-text\"\n  }, \"9\"))))), mdx(\"h3\", null, \"4. Connect the Temperature & Humidity Sensor\"), mdx(\"p\", null, \"Seat the temperature & humidity sensor in the breadboard, then connect the ground and power pins to the ground and power breadboard rails, respectively. Connect the signal pin to the Arduino \", mdx(\"code\", {\n    parentName: \"p\",\n    \"className\": \"language-text\"\n  }, \"A0\"), \" pin.\"), mdx(\"h3\", null, \"5. Connect the Relays\"), mdx(\"p\", null, \"Connect the ground and power pins of each relay to the ground and power breadboard rails, respectively. Finally, connect each relay's signal pin to the Arduino according to its purpose:\"), mdx(\"table\", null, mdx(\"thead\", {\n    parentName: \"table\"\n  }, mdx(\"tr\", {\n    parentName: \"thead\"\n  }, mdx(\"th\", {\n    parentName: \"tr\",\n    \"align\": null\n  }, \"Purpose\"), mdx(\"th\", {\n    parentName: \"tr\",\n    \"align\": null\n  }, \"Arduino Pin\"))), mdx(\"tbody\", {\n    parentName: \"table\"\n  }, mdx(\"tr\", {\n    parentName: \"tbody\"\n  }, mdx(\"td\", {\n    parentName: \"tr\",\n    \"align\": null\n  }, \"Heating\"), mdx(\"td\", {\n    parentName: \"tr\",\n    \"align\": null\n  }, mdx(\"code\", {\n    parentName: \"td\",\n    \"className\": \"language-text\"\n  }, \"13\"))), mdx(\"tr\", {\n    parentName: \"tbody\"\n  }, mdx(\"td\", {\n    parentName: \"tr\",\n    \"align\": null\n  }, \"Cooling\"), mdx(\"td\", {\n    parentName: \"tr\",\n    \"align\": null\n  }, mdx(\"code\", {\n    parentName: \"td\",\n    \"className\": \"language-text\"\n  }, \"10\"))))), mdx(\"h3\", null, \"6. Check connections\"), mdx(\"p\", null, \"Ensure each connection is secure. The final build should look something like this (note: LEDs used as a stand-in for the relays).\"), mdx(\"p\", null, mdx(\"img\", {\n    parentName: \"p\",\n    \"src\": \"../img/arduino-thermostat_1073x1072.jpg\",\n    \"alt\": \"Picture of an Arduino powered thermostat\"\n  })), mdx(\"h2\", null, \"Write the Software\"), mdx(\"h3\", null, \"1. Import the DHT library\"), mdx(\"p\", null, \"The DHT library is not available by default. To install it, navigate in the Arduino IDE to \", mdx(\"strong\", {\n    parentName: \"p\"\n  }, \"Tools\"), \" \\u27A1 \", mdx(\"strong\", {\n    parentName: \"p\"\n  }, \"Manage Libraries...\"), \" then search for \\\"DHT sensor library\\\" and install it.\"), mdx(\"h3\", null, \"2. Write (or copy & paste) the code\"), mdx(\"p\", null, \"Here is the full, annotated code for the thermostat:\"), mdx(\"div\", {\n    \"className\": \"gatsby-highlight\",\n    \"data-language\": \"cpp\"\n  }, mdx(\"pre\", {\n    parentName: \"div\",\n    \"className\": \"language-cpp\"\n  }, mdx(\"code\", {\n    parentName: \"pre\",\n    \"className\": \"language-cpp\"\n  }, mdx(\"span\", {\n    parentName: \"code\",\n    \"className\": \"token comment\"\n  }, \"// written by Dylon Jamna, modified by Micah Beeler, further modified by James Tharpe\"), \"\\n\", mdx(\"span\", {\n    parentName: \"code\",\n    \"className\": \"token comment\"\n  }, \"// Original code: https://pastebin.com/HKbJjKxE\"), \"\\n\", mdx(\"span\", {\n    parentName: \"code\",\n    \"className\": \"token comment\"\n  }, \"// Original instructions: https://www.instructables.com/Arduino-Thermostat/\"), \"\\n\\n\", mdx(\"span\", {\n    parentName: \"code\",\n    \"className\": \"token macro property\"\n  }, mdx(\"span\", {\n    parentName: \"span\",\n    \"className\": \"token directive-hash\"\n  }, \"#\"), mdx(\"span\", {\n    parentName: \"span\",\n    \"className\": \"token directive keyword\"\n  }, \"include\"), \" \", mdx(\"span\", {\n    parentName: \"span\",\n    \"className\": \"token string\"\n  }, \"<LiquidCrystal.h>\")), \"\\n\", mdx(\"span\", {\n    parentName: \"code\",\n    \"className\": \"token macro property\"\n  }, mdx(\"span\", {\n    parentName: \"span\",\n    \"className\": \"token directive-hash\"\n  }, \"#\"), mdx(\"span\", {\n    parentName: \"span\",\n    \"className\": \"token directive keyword\"\n  }, \"include\"), \" \", mdx(\"span\", {\n    parentName: \"span\",\n    \"className\": \"token string\"\n  }, \"<DHT.h>\")), \"\\n\\n\", mdx(\"span\", {\n    parentName: \"code\",\n    \"className\": \"token comment\"\n  }, \"// Sensor Configuration: Should map to temperature & humidity\"), \"\\n\", mdx(\"span\", {\n    parentName: \"code\",\n    \"className\": \"token comment\"\n  }, \"// sensor connections to the Arduino\"), \"\\n\", mdx(\"span\", {\n    parentName: \"code\",\n    \"className\": \"token keyword\"\n  }, \"const\"), \" \", mdx(\"span\", {\n    parentName: \"code\",\n    \"className\": \"token keyword\"\n  }, \"int\"), \"\\n\\tDHT_PIN \", mdx(\"span\", {\n    parentName: \"code\",\n    \"className\": \"token operator\"\n  }, \"=\"), \" A0\", mdx(\"span\", {\n    parentName: \"code\",\n    \"className\": \"token punctuation\"\n  }, \",\"), \"\\n\\tDHT_TYPE \", mdx(\"span\", {\n    parentName: \"code\",\n    \"className\": \"token operator\"\n  }, \"=\"), \" DHT11\", mdx(\"span\", {\n    parentName: \"code\",\n    \"className\": \"token punctuation\"\n  }, \";\"), \"\\n\\nDHT \", mdx(\"span\", {\n    parentName: \"code\",\n    \"className\": \"token function\"\n  }, \"sensor\"), mdx(\"span\", {\n    parentName: \"code\",\n    \"className\": \"token punctuation\"\n  }, \"(\"), \"DHT_PIN\", mdx(\"span\", {\n    parentName: \"code\",\n    \"className\": \"token punctuation\"\n  }, \",\"), \" DHT_TYPE\", mdx(\"span\", {\n    parentName: \"code\",\n    \"className\": \"token punctuation\"\n  }, \")\"), mdx(\"span\", {\n    parentName: \"code\",\n    \"className\": \"token punctuation\"\n  }, \";\"), \"\\n\\n\", mdx(\"span\", {\n    parentName: \"code\",\n    \"className\": \"token comment\"\n  }, \"// LCD Configuration: Should map to temperature & humidity\"), \"\\n\", mdx(\"span\", {\n    parentName: \"code\",\n    \"className\": \"token comment\"\n  }, \"// sensor connections to the Arduino\"), \"\\n\", mdx(\"span\", {\n    parentName: \"code\",\n    \"className\": \"token keyword\"\n  }, \"const\"), \" \", mdx(\"span\", {\n    parentName: \"code\",\n    \"className\": \"token keyword\"\n  }, \"int\"), \"\\n\\tLCD_PIN_RS \", mdx(\"span\", {\n    parentName: \"code\",\n    \"className\": \"token operator\"\n  }, \"=\"), \" \", mdx(\"span\", {\n    parentName: \"code\",\n    \"className\": \"token number\"\n  }, \"11\"), mdx(\"span\", {\n    parentName: \"code\",\n    \"className\": \"token punctuation\"\n  }, \",\"), \"\\n\\tLCD_PIN_EN \", mdx(\"span\", {\n    parentName: \"code\",\n    \"className\": \"token operator\"\n  }, \"=\"), \" \", mdx(\"span\", {\n    parentName: \"code\",\n    \"className\": \"token number\"\n  }, \"12\"), mdx(\"span\", {\n    parentName: \"code\",\n    \"className\": \"token punctuation\"\n  }, \",\"), \"\\n\\tLCD_PIN_D4 \", mdx(\"span\", {\n    parentName: \"code\",\n    \"className\": \"token operator\"\n  }, \"=\"), \" \", mdx(\"span\", {\n    parentName: \"code\",\n    \"className\": \"token number\"\n  }, \"2\"), mdx(\"span\", {\n    parentName: \"code\",\n    \"className\": \"token punctuation\"\n  }, \",\"), \"\\n\\tLCD_PIN_D5 \", mdx(\"span\", {\n    parentName: \"code\",\n    \"className\": \"token operator\"\n  }, \"=\"), \" \", mdx(\"span\", {\n    parentName: \"code\",\n    \"className\": \"token number\"\n  }, \"3\"), mdx(\"span\", {\n    parentName: \"code\",\n    \"className\": \"token punctuation\"\n  }, \",\"), \"\\n\\tLCD_PIN_D6 \", mdx(\"span\", {\n    parentName: \"code\",\n    \"className\": \"token operator\"\n  }, \"=\"), \" \", mdx(\"span\", {\n    parentName: \"code\",\n    \"className\": \"token number\"\n  }, \"4\"), mdx(\"span\", {\n    parentName: \"code\",\n    \"className\": \"token punctuation\"\n  }, \",\"), \"\\n\\tLCD_PIN_D7 \", mdx(\"span\", {\n    parentName: \"code\",\n    \"className\": \"token operator\"\n  }, \"=\"), \" \", mdx(\"span\", {\n    parentName: \"code\",\n    \"className\": \"token number\"\n  }, \"5\"), mdx(\"span\", {\n    parentName: \"code\",\n    \"className\": \"token punctuation\"\n  }, \";\"), \"\\n\\nLiquidCrystal \", mdx(\"span\", {\n    parentName: \"code\",\n    \"className\": \"token function\"\n  }, \"lcd\"), mdx(\"span\", {\n    parentName: \"code\",\n    \"className\": \"token punctuation\"\n  }, \"(\"), \"\\n\\tLCD_PIN_RS\", mdx(\"span\", {\n    parentName: \"code\",\n    \"className\": \"token punctuation\"\n  }, \",\"), \"\\n\\tLCD_PIN_EN\", mdx(\"span\", {\n    parentName: \"code\",\n    \"className\": \"token punctuation\"\n  }, \",\"), \"\\n\\tLCD_PIN_D4\", mdx(\"span\", {\n    parentName: \"code\",\n    \"className\": \"token punctuation\"\n  }, \",\"), \"\\n\\tLCD_PIN_D5\", mdx(\"span\", {\n    parentName: \"code\",\n    \"className\": \"token punctuation\"\n  }, \",\"), \"\\n\\tLCD_PIN_D6\", mdx(\"span\", {\n    parentName: \"code\",\n    \"className\": \"token punctuation\"\n  }, \",\"), \"\\n\\tLCD_PIN_D7\", mdx(\"span\", {\n    parentName: \"code\",\n    \"className\": \"token punctuation\"\n  }, \")\"), mdx(\"span\", {\n    parentName: \"code\",\n    \"className\": \"token punctuation\"\n  }, \";\"), \"\\n\\n\", mdx(\"span\", {\n    parentName: \"code\",\n    \"className\": \"token comment\"\n  }, \"// Button configuration\"), \"\\n\", mdx(\"span\", {\n    parentName: \"code\",\n    \"className\": \"token keyword\"\n  }, \"const\"), \" \", mdx(\"span\", {\n    parentName: \"code\",\n    \"className\": \"token keyword\"\n  }, \"int\"), \"\\n\\tDECREMENT_BTN_PIN \", mdx(\"span\", {\n    parentName: \"code\",\n    \"className\": \"token operator\"\n  }, \"=\"), \" \", mdx(\"span\", {\n    parentName: \"code\",\n    \"className\": \"token number\"\n  }, \"7\"), mdx(\"span\", {\n    parentName: \"code\",\n    \"className\": \"token punctuation\"\n  }, \",\"), \"\\n\\tTOGGLE_BTN_PIN \", mdx(\"span\", {\n    parentName: \"code\",\n    \"className\": \"token operator\"\n  }, \"=\"), \" \", mdx(\"span\", {\n    parentName: \"code\",\n    \"className\": \"token number\"\n  }, \"8\"), mdx(\"span\", {\n    parentName: \"code\",\n    \"className\": \"token punctuation\"\n  }, \",\"), \"\\n\\tINCREMENT_BTN_PIN \", mdx(\"span\", {\n    parentName: \"code\",\n    \"className\": \"token operator\"\n  }, \"=\"), \" \", mdx(\"span\", {\n    parentName: \"code\",\n    \"className\": \"token number\"\n  }, \"9\"), mdx(\"span\", {\n    parentName: \"code\",\n    \"className\": \"token punctuation\"\n  }, \";\"), \"\\n\\n\", mdx(\"span\", {\n    parentName: \"code\",\n    \"className\": \"token comment\"\n  }, \"// \\\"Heater\\\" and \\\"cooler\\\" configuration\"), \"\\n\", mdx(\"span\", {\n    parentName: \"code\",\n    \"className\": \"token keyword\"\n  }, \"const\"), \" \", mdx(\"span\", {\n    parentName: \"code\",\n    \"className\": \"token keyword\"\n  }, \"int\"), \"\\n\\tHEATER_PIN \", mdx(\"span\", {\n    parentName: \"code\",\n    \"className\": \"token operator\"\n  }, \"=\"), \" \", mdx(\"span\", {\n    parentName: \"code\",\n    \"className\": \"token number\"\n  }, \"13\"), mdx(\"span\", {\n    parentName: \"code\",\n    \"className\": \"token punctuation\"\n  }, \",\"), \"\\n\\tCOOLER_PIN \", mdx(\"span\", {\n    parentName: \"code\",\n    \"className\": \"token operator\"\n  }, \"=\"), \" \", mdx(\"span\", {\n    parentName: \"code\",\n    \"className\": \"token number\"\n  }, \"10\"), mdx(\"span\", {\n    parentName: \"code\",\n    \"className\": \"token punctuation\"\n  }, \";\"), \"\\n\\n\", mdx(\"span\", {\n    parentName: \"code\",\n    \"className\": \"token comment\"\n  }, \"// Controls\"), \"\\n\", mdx(\"span\", {\n    parentName: \"code\",\n    \"className\": \"token keyword\"\n  }, \"bool\"), \" useFahrenheit \", mdx(\"span\", {\n    parentName: \"code\",\n    \"className\": \"token operator\"\n  }, \"=\"), \" \", mdx(\"span\", {\n    parentName: \"code\",\n    \"className\": \"token boolean\"\n  }, \"true\"), mdx(\"span\", {\n    parentName: \"code\",\n    \"className\": \"token punctuation\"\n  }, \";\"), \"\\n\", mdx(\"span\", {\n    parentName: \"code\",\n    \"className\": \"token keyword\"\n  }, \"int\"), \" targetF \", mdx(\"span\", {\n    parentName: \"code\",\n    \"className\": \"token operator\"\n  }, \"=\"), \" \", mdx(\"span\", {\n    parentName: \"code\",\n    \"className\": \"token number\"\n  }, \"72\"), mdx(\"span\", {\n    parentName: \"code\",\n    \"className\": \"token punctuation\"\n  }, \",\"), \" targetC \", mdx(\"span\", {\n    parentName: \"code\",\n    \"className\": \"token operator\"\n  }, \"=\"), \" \", mdx(\"span\", {\n    parentName: \"code\",\n    \"className\": \"token number\"\n  }, \"22\"), mdx(\"span\", {\n    parentName: \"code\",\n    \"className\": \"token punctuation\"\n  }, \";\"), \"\\n\\n\", mdx(\"span\", {\n    parentName: \"code\",\n    \"className\": \"token keyword\"\n  }, \"void\"), \" \", mdx(\"span\", {\n    parentName: \"code\",\n    \"className\": \"token function\"\n  }, \"setup\"), mdx(\"span\", {\n    parentName: \"code\",\n    \"className\": \"token punctuation\"\n  }, \"(\"), mdx(\"span\", {\n    parentName: \"code\",\n    \"className\": \"token punctuation\"\n  }, \")\"), \" \", mdx(\"span\", {\n    parentName: \"code\",\n    \"className\": \"token punctuation\"\n  }, \"{\"), \"\\n  \", mdx(\"span\", {\n    parentName: \"code\",\n    \"className\": \"token comment\"\n  }, \"// Serial (for logging)\"), \"\\n  Serial\", mdx(\"span\", {\n    parentName: \"code\",\n    \"className\": \"token punctuation\"\n  }, \".\"), mdx(\"span\", {\n    parentName: \"code\",\n    \"className\": \"token function\"\n  }, \"begin\"), \" \", mdx(\"span\", {\n    parentName: \"code\",\n    \"className\": \"token punctuation\"\n  }, \"(\"), mdx(\"span\", {\n    parentName: \"code\",\n    \"className\": \"token number\"\n  }, \"9600\"), mdx(\"span\", {\n    parentName: \"code\",\n    \"className\": \"token punctuation\"\n  }, \")\"), mdx(\"span\", {\n    parentName: \"code\",\n    \"className\": \"token punctuation\"\n  }, \";\"), \"\\n  Serial\", mdx(\"span\", {\n    parentName: \"code\",\n    \"className\": \"token punctuation\"\n  }, \".\"), mdx(\"span\", {\n    parentName: \"code\",\n    \"className\": \"token function\"\n  }, \"print\"), mdx(\"span\", {\n    parentName: \"code\",\n    \"className\": \"token punctuation\"\n  }, \"(\"), mdx(\"span\", {\n    parentName: \"code\",\n    \"className\": \"token string\"\n  }, \"\\\"setup()\\\\n\\\"\"), mdx(\"span\", {\n    parentName: \"code\",\n    \"className\": \"token punctuation\"\n  }, \")\"), mdx(\"span\", {\n    parentName: \"code\",\n    \"className\": \"token punctuation\"\n  }, \";\"), \"\\n\\n  \", mdx(\"span\", {\n    parentName: \"code\",\n    \"className\": \"token comment\"\n  }, \"// Sensor\"), \"\\n  sensor\", mdx(\"span\", {\n    parentName: \"code\",\n    \"className\": \"token punctuation\"\n  }, \".\"), mdx(\"span\", {\n    parentName: \"code\",\n    \"className\": \"token function\"\n  }, \"begin\"), mdx(\"span\", {\n    parentName: \"code\",\n    \"className\": \"token punctuation\"\n  }, \"(\"), mdx(\"span\", {\n    parentName: \"code\",\n    \"className\": \"token punctuation\"\n  }, \")\"), mdx(\"span\", {\n    parentName: \"code\",\n    \"className\": \"token punctuation\"\n  }, \";\"), \"\\n  Serial\", mdx(\"span\", {\n    parentName: \"code\",\n    \"className\": \"token punctuation\"\n  }, \".\"), mdx(\"span\", {\n    parentName: \"code\",\n    \"className\": \"token function\"\n  }, \"print\"), mdx(\"span\", {\n    parentName: \"code\",\n    \"className\": \"token punctuation\"\n  }, \"(\"), mdx(\"span\", {\n    parentName: \"code\",\n    \"className\": \"token string\"\n  }, \"\\\"\\\\tsensor initialized\\\\n\\\"\"), mdx(\"span\", {\n    parentName: \"code\",\n    \"className\": \"token punctuation\"\n  }, \")\"), mdx(\"span\", {\n    parentName: \"code\",\n    \"className\": \"token punctuation\"\n  }, \";\"), \"\\n\\n  \", mdx(\"span\", {\n    parentName: \"code\",\n    \"className\": \"token comment\"\n  }, \"// LCD\"), \"\\n  lcd\", mdx(\"span\", {\n    parentName: \"code\",\n    \"className\": \"token punctuation\"\n  }, \".\"), mdx(\"span\", {\n    parentName: \"code\",\n    \"className\": \"token function\"\n  }, \"begin\"), mdx(\"span\", {\n    parentName: \"code\",\n    \"className\": \"token punctuation\"\n  }, \"(\"), mdx(\"span\", {\n    parentName: \"code\",\n    \"className\": \"token number\"\n  }, \"16\"), mdx(\"span\", {\n    parentName: \"code\",\n    \"className\": \"token punctuation\"\n  }, \",\"), \" \", mdx(\"span\", {\n    parentName: \"code\",\n    \"className\": \"token number\"\n  }, \"2\"), mdx(\"span\", {\n    parentName: \"code\",\n    \"className\": \"token punctuation\"\n  }, \")\"), mdx(\"span\", {\n    parentName: \"code\",\n    \"className\": \"token punctuation\"\n  }, \";\"), \"\\n  lcd\", mdx(\"span\", {\n    parentName: \"code\",\n    \"className\": \"token punctuation\"\n  }, \".\"), mdx(\"span\", {\n    parentName: \"code\",\n    \"className\": \"token function\"\n  }, \"setCursor\"), mdx(\"span\", {\n    parentName: \"code\",\n    \"className\": \"token punctuation\"\n  }, \"(\"), mdx(\"span\", {\n    parentName: \"code\",\n    \"className\": \"token number\"\n  }, \"0\"), mdx(\"span\", {\n    parentName: \"code\",\n    \"className\": \"token punctuation\"\n  }, \",\"), \" \", mdx(\"span\", {\n    parentName: \"code\",\n    \"className\": \"token number\"\n  }, \"0\"), mdx(\"span\", {\n    parentName: \"code\",\n    \"className\": \"token punctuation\"\n  }, \")\"), mdx(\"span\", {\n    parentName: \"code\",\n    \"className\": \"token punctuation\"\n  }, \";\"), \"\\n  lcd\", mdx(\"span\", {\n    parentName: \"code\",\n    \"className\": \"token punctuation\"\n  }, \".\"), mdx(\"span\", {\n    parentName: \"code\",\n    \"className\": \"token function\"\n  }, \"clear\"), mdx(\"span\", {\n    parentName: \"code\",\n    \"className\": \"token punctuation\"\n  }, \"(\"), mdx(\"span\", {\n    parentName: \"code\",\n    \"className\": \"token punctuation\"\n  }, \")\"), mdx(\"span\", {\n    parentName: \"code\",\n    \"className\": \"token punctuation\"\n  }, \";\"), \"\\n  Serial\", mdx(\"span\", {\n    parentName: \"code\",\n    \"className\": \"token punctuation\"\n  }, \".\"), mdx(\"span\", {\n    parentName: \"code\",\n    \"className\": \"token function\"\n  }, \"print\"), mdx(\"span\", {\n    parentName: \"code\",\n    \"className\": \"token punctuation\"\n  }, \"(\"), mdx(\"span\", {\n    parentName: \"code\",\n    \"className\": \"token string\"\n  }, \"\\\"\\\\tLCD initialized\\\\n\\\"\"), mdx(\"span\", {\n    parentName: \"code\",\n    \"className\": \"token punctuation\"\n  }, \")\"), mdx(\"span\", {\n    parentName: \"code\",\n    \"className\": \"token punctuation\"\n  }, \";\"), \"\\n\\n  \", mdx(\"span\", {\n    parentName: \"code\",\n    \"className\": \"token comment\"\n  }, \"// Buttons\"), \"\\n  \", mdx(\"span\", {\n    parentName: \"code\",\n    \"className\": \"token function\"\n  }, \"pinMode\"), mdx(\"span\", {\n    parentName: \"code\",\n    \"className\": \"token punctuation\"\n  }, \"(\"), \"INCREMENT_BTN_PIN\", mdx(\"span\", {\n    parentName: \"code\",\n    \"className\": \"token punctuation\"\n  }, \",\"), \" INPUT\", mdx(\"span\", {\n    parentName: \"code\",\n    \"className\": \"token punctuation\"\n  }, \")\"), mdx(\"span\", {\n    parentName: \"code\",\n    \"className\": \"token punctuation\"\n  }, \";\"), \"\\n  \", mdx(\"span\", {\n    parentName: \"code\",\n    \"className\": \"token function\"\n  }, \"pinMode\"), mdx(\"span\", {\n    parentName: \"code\",\n    \"className\": \"token punctuation\"\n  }, \"(\"), \"DECREMENT_BTN_PIN\", mdx(\"span\", {\n    parentName: \"code\",\n    \"className\": \"token punctuation\"\n  }, \",\"), \" INPUT\", mdx(\"span\", {\n    parentName: \"code\",\n    \"className\": \"token punctuation\"\n  }, \")\"), mdx(\"span\", {\n    parentName: \"code\",\n    \"className\": \"token punctuation\"\n  }, \";\"), \"\\n  \", mdx(\"span\", {\n    parentName: \"code\",\n    \"className\": \"token function\"\n  }, \"pinMode\"), mdx(\"span\", {\n    parentName: \"code\",\n    \"className\": \"token punctuation\"\n  }, \"(\"), \"TOGGLE_BTN_PIN\", mdx(\"span\", {\n    parentName: \"code\",\n    \"className\": \"token punctuation\"\n  }, \",\"), \" INPUT\", mdx(\"span\", {\n    parentName: \"code\",\n    \"className\": \"token punctuation\"\n  }, \")\"), mdx(\"span\", {\n    parentName: \"code\",\n    \"className\": \"token punctuation\"\n  }, \";\"), \"\\n  Serial\", mdx(\"span\", {\n    parentName: \"code\",\n    \"className\": \"token punctuation\"\n  }, \".\"), mdx(\"span\", {\n    parentName: \"code\",\n    \"className\": \"token function\"\n  }, \"print\"), mdx(\"span\", {\n    parentName: \"code\",\n    \"className\": \"token punctuation\"\n  }, \"(\"), mdx(\"span\", {\n    parentName: \"code\",\n    \"className\": \"token string\"\n  }, \"\\\"\\\\tButtons initialized\\\\n\\\"\"), mdx(\"span\", {\n    parentName: \"code\",\n    \"className\": \"token punctuation\"\n  }, \")\"), mdx(\"span\", {\n    parentName: \"code\",\n    \"className\": \"token punctuation\"\n  }, \";\"), \"\\n  \\n  \", mdx(\"span\", {\n    parentName: \"code\",\n    \"className\": \"token comment\"\n  }, \"// Temperature Controllers\"), \"\\n  \", mdx(\"span\", {\n    parentName: \"code\",\n    \"className\": \"token function\"\n  }, \"pinMode\"), mdx(\"span\", {\n    parentName: \"code\",\n    \"className\": \"token punctuation\"\n  }, \"(\"), \"HEATER_PIN\", mdx(\"span\", {\n    parentName: \"code\",\n    \"className\": \"token punctuation\"\n  }, \",\"), \" OUTPUT\", mdx(\"span\", {\n    parentName: \"code\",\n    \"className\": \"token punctuation\"\n  }, \")\"), mdx(\"span\", {\n    parentName: \"code\",\n    \"className\": \"token punctuation\"\n  }, \";\"), \"\\n  \", mdx(\"span\", {\n    parentName: \"code\",\n    \"className\": \"token function\"\n  }, \"pinMode\"), mdx(\"span\", {\n    parentName: \"code\",\n    \"className\": \"token punctuation\"\n  }, \"(\"), \"COOLER_PIN\", mdx(\"span\", {\n    parentName: \"code\",\n    \"className\": \"token punctuation\"\n  }, \",\"), \" OUTPUT\", mdx(\"span\", {\n    parentName: \"code\",\n    \"className\": \"token punctuation\"\n  }, \")\"), mdx(\"span\", {\n    parentName: \"code\",\n    \"className\": \"token punctuation\"\n  }, \";\"), \"\\n  \\n  Serial\", mdx(\"span\", {\n    parentName: \"code\",\n    \"className\": \"token punctuation\"\n  }, \".\"), mdx(\"span\", {\n    parentName: \"code\",\n    \"className\": \"token function\"\n  }, \"print\"), mdx(\"span\", {\n    parentName: \"code\",\n    \"className\": \"token punctuation\"\n  }, \"(\"), mdx(\"span\", {\n    parentName: \"code\",\n    \"className\": \"token string\"\n  }, \"\\\"setup() DONE\\\\n\\\"\"), mdx(\"span\", {\n    parentName: \"code\",\n    \"className\": \"token punctuation\"\n  }, \")\"), mdx(\"span\", {\n    parentName: \"code\",\n    \"className\": \"token punctuation\"\n  }, \";\"), \"\\n\", mdx(\"span\", {\n    parentName: \"code\",\n    \"className\": \"token punctuation\"\n  }, \"}\"), \"\\n\\n\", mdx(\"span\", {\n    parentName: \"code\",\n    \"className\": \"token keyword\"\n  }, \"void\"), \" \", mdx(\"span\", {\n    parentName: \"code\",\n    \"className\": \"token function\"\n  }, \"loop\"), mdx(\"span\", {\n    parentName: \"code\",\n    \"className\": \"token punctuation\"\n  }, \"(\"), mdx(\"span\", {\n    parentName: \"code\",\n    \"className\": \"token punctuation\"\n  }, \")\"), \" \", mdx(\"span\", {\n    parentName: \"code\",\n    \"className\": \"token punctuation\"\n  }, \"{\"), \"\\n  Serial\", mdx(\"span\", {\n    parentName: \"code\",\n    \"className\": \"token punctuation\"\n  }, \".\"), mdx(\"span\", {\n    parentName: \"code\",\n    \"className\": \"token function\"\n  }, \"print\"), mdx(\"span\", {\n    parentName: \"code\",\n    \"className\": \"token punctuation\"\n  }, \"(\"), mdx(\"span\", {\n    parentName: \"code\",\n    \"className\": \"token string\"\n  }, \"\\\"loop()\\\\n\\\"\"), mdx(\"span\", {\n    parentName: \"code\",\n    \"className\": \"token punctuation\"\n  }, \")\"), mdx(\"span\", {\n    parentName: \"code\",\n    \"className\": \"token punctuation\"\n  }, \";\"), \"\\n\\n  \", mdx(\"span\", {\n    parentName: \"code\",\n    \"className\": \"token comment\"\n  }, \"// Read Button State\"), \"\\n  \", mdx(\"span\", {\n    parentName: \"code\",\n    \"className\": \"token keyword\"\n  }, \"bool\"), \" incrementTarget \", mdx(\"span\", {\n    parentName: \"code\",\n    \"className\": \"token operator\"\n  }, \"=\"), \" \", mdx(\"span\", {\n    parentName: \"code\",\n    \"className\": \"token function\"\n  }, \"digitalRead\"), mdx(\"span\", {\n    parentName: \"code\",\n    \"className\": \"token punctuation\"\n  }, \"(\"), \"INCREMENT_BTN_PIN\", mdx(\"span\", {\n    parentName: \"code\",\n    \"className\": \"token punctuation\"\n  }, \")\"), mdx(\"span\", {\n    parentName: \"code\",\n    \"className\": \"token punctuation\"\n  }, \";\"), \"\\n  \", mdx(\"span\", {\n    parentName: \"code\",\n    \"className\": \"token keyword\"\n  }, \"bool\"), \" decrementTarget \", mdx(\"span\", {\n    parentName: \"code\",\n    \"className\": \"token operator\"\n  }, \"=\"), \" \", mdx(\"span\", {\n    parentName: \"code\",\n    \"className\": \"token function\"\n  }, \"digitalRead\"), mdx(\"span\", {\n    parentName: \"code\",\n    \"className\": \"token punctuation\"\n  }, \"(\"), \"DECREMENT_BTN_PIN\", mdx(\"span\", {\n    parentName: \"code\",\n    \"className\": \"token punctuation\"\n  }, \")\"), mdx(\"span\", {\n    parentName: \"code\",\n    \"className\": \"token punctuation\"\n  }, \";\"), \"\\n  \", mdx(\"span\", {\n    parentName: \"code\",\n    \"className\": \"token keyword\"\n  }, \"bool\"), \" toggle \", mdx(\"span\", {\n    parentName: \"code\",\n    \"className\": \"token operator\"\n  }, \"=\"), \" \", mdx(\"span\", {\n    parentName: \"code\",\n    \"className\": \"token function\"\n  }, \"digitalRead\"), mdx(\"span\", {\n    parentName: \"code\",\n    \"className\": \"token punctuation\"\n  }, \"(\"), \"TOGGLE_BTN_PIN\", mdx(\"span\", {\n    parentName: \"code\",\n    \"className\": \"token punctuation\"\n  }, \")\"), \" \", mdx(\"span\", {\n    parentName: \"code\",\n    \"className\": \"token operator\"\n  }, \"==\"), \" HIGH\", mdx(\"span\", {\n    parentName: \"code\",\n    \"className\": \"token punctuation\"\n  }, \";\"), \"\\n  \", mdx(\"span\", {\n    parentName: \"code\",\n    \"className\": \"token keyword\"\n  }, \"bool\"), \" wait \", mdx(\"span\", {\n    parentName: \"code\",\n    \"className\": \"token operator\"\n  }, \"=\"), \" incrementTarget \", mdx(\"span\", {\n    parentName: \"code\",\n    \"className\": \"token operator\"\n  }, \"||\"), \" decrementTarget \", mdx(\"span\", {\n    parentName: \"code\",\n    \"className\": \"token operator\"\n  }, \"||\"), \" toggle\", mdx(\"span\", {\n    parentName: \"code\",\n    \"className\": \"token punctuation\"\n  }, \";\"), \"\\n\\n  \", mdx(\"span\", {\n    parentName: \"code\",\n    \"className\": \"token comment\"\n  }, \"// Configure\"), \"\\n  \", mdx(\"span\", {\n    parentName: \"code\",\n    \"className\": \"token keyword\"\n  }, \"if\"), mdx(\"span\", {\n    parentName: \"code\",\n    \"className\": \"token punctuation\"\n  }, \"(\"), \"toggle\", mdx(\"span\", {\n    parentName: \"code\",\n    \"className\": \"token punctuation\"\n  }, \")\"), \" useFahrenheit \", mdx(\"span\", {\n    parentName: \"code\",\n    \"className\": \"token operator\"\n  }, \"=\"), \" \", mdx(\"span\", {\n    parentName: \"code\",\n    \"className\": \"token operator\"\n  }, \"!\"), \"useFahrenheit\", mdx(\"span\", {\n    parentName: \"code\",\n    \"className\": \"token punctuation\"\n  }, \";\"), \"\\n  \", mdx(\"span\", {\n    parentName: \"code\",\n    \"className\": \"token keyword\"\n  }, \"if\"), \" \", mdx(\"span\", {\n    parentName: \"code\",\n    \"className\": \"token punctuation\"\n  }, \"(\"), \"incrementTarget\", mdx(\"span\", {\n    parentName: \"code\",\n    \"className\": \"token punctuation\"\n  }, \")\"), \" \", mdx(\"span\", {\n    parentName: \"code\",\n    \"className\": \"token punctuation\"\n  }, \"{\"), \" targetF\", mdx(\"span\", {\n    parentName: \"code\",\n    \"className\": \"token operator\"\n  }, \"++\"), mdx(\"span\", {\n    parentName: \"code\",\n    \"className\": \"token punctuation\"\n  }, \";\"), \" targetC\", mdx(\"span\", {\n    parentName: \"code\",\n    \"className\": \"token operator\"\n  }, \"++\"), mdx(\"span\", {\n    parentName: \"code\",\n    \"className\": \"token punctuation\"\n  }, \";\"), \" \", mdx(\"span\", {\n    parentName: \"code\",\n    \"className\": \"token punctuation\"\n  }, \"}\"), \"\\n  \", mdx(\"span\", {\n    parentName: \"code\",\n    \"className\": \"token keyword\"\n  }, \"if\"), \" \", mdx(\"span\", {\n    parentName: \"code\",\n    \"className\": \"token punctuation\"\n  }, \"(\"), \"decrementTarget\", mdx(\"span\", {\n    parentName: \"code\",\n    \"className\": \"token punctuation\"\n  }, \")\"), \" \", mdx(\"span\", {\n    parentName: \"code\",\n    \"className\": \"token punctuation\"\n  }, \"{\"), \" targetF\", mdx(\"span\", {\n    parentName: \"code\",\n    \"className\": \"token operator\"\n  }, \"--\"), mdx(\"span\", {\n    parentName: \"code\",\n    \"className\": \"token punctuation\"\n  }, \";\"), \" targetC\", mdx(\"span\", {\n    parentName: \"code\",\n    \"className\": \"token operator\"\n  }, \"--\"), mdx(\"span\", {\n    parentName: \"code\",\n    \"className\": \"token punctuation\"\n  }, \";\"), \" \", mdx(\"span\", {\n    parentName: \"code\",\n    \"className\": \"token punctuation\"\n  }, \"}\"), \"\\n  \", mdx(\"span\", {\n    parentName: \"code\",\n    \"className\": \"token keyword\"\n  }, \"const\"), \" \", mdx(\"span\", {\n    parentName: \"code\",\n    \"className\": \"token keyword\"\n  }, \"char\"), \" symbol \", mdx(\"span\", {\n    parentName: \"code\",\n    \"className\": \"token operator\"\n  }, \"=\"), \" useFahrenheit \", mdx(\"span\", {\n    parentName: \"code\",\n    \"className\": \"token operator\"\n  }, \"?\"), \" \", mdx(\"span\", {\n    parentName: \"code\",\n    \"className\": \"token char\"\n  }, \"'F'\"), \" \", mdx(\"span\", {\n    parentName: \"code\",\n    \"className\": \"token operator\"\n  }, \":\"), \" \", mdx(\"span\", {\n    parentName: \"code\",\n    \"className\": \"token char\"\n  }, \"'C'\"), mdx(\"span\", {\n    parentName: \"code\",\n    \"className\": \"token punctuation\"\n  }, \";\"), \"\\n  \", mdx(\"span\", {\n    parentName: \"code\",\n    \"className\": \"token keyword\"\n  }, \"const\"), \" \", mdx(\"span\", {\n    parentName: \"code\",\n    \"className\": \"token keyword\"\n  }, \"int\"), \" target \", mdx(\"span\", {\n    parentName: \"code\",\n    \"className\": \"token operator\"\n  }, \"=\"), \" useFahrenheit \", mdx(\"span\", {\n    parentName: \"code\",\n    \"className\": \"token operator\"\n  }, \"?\"), \" targetF \", mdx(\"span\", {\n    parentName: \"code\",\n    \"className\": \"token operator\"\n  }, \":\"), \" targetC\", mdx(\"span\", {\n    parentName: \"code\",\n    \"className\": \"token punctuation\"\n  }, \";\"), \"\\n\\n  \", mdx(\"span\", {\n    parentName: \"code\",\n    \"className\": \"token comment\"\n  }, \"// Read Sensor Data\"), \"\\n  \", mdx(\"span\", {\n    parentName: \"code\",\n    \"className\": \"token keyword\"\n  }, \"float\"), \" temperature \", mdx(\"span\", {\n    parentName: \"code\",\n    \"className\": \"token operator\"\n  }, \"=\"), \" sensor\", mdx(\"span\", {\n    parentName: \"code\",\n    \"className\": \"token punctuation\"\n  }, \".\"), mdx(\"span\", {\n    parentName: \"code\",\n    \"className\": \"token function\"\n  }, \"readTemperature\"), mdx(\"span\", {\n    parentName: \"code\",\n    \"className\": \"token punctuation\"\n  }, \"(\"), \"useFahrenheit\", mdx(\"span\", {\n    parentName: \"code\",\n    \"className\": \"token punctuation\"\n  }, \")\"), mdx(\"span\", {\n    parentName: \"code\",\n    \"className\": \"token punctuation\"\n  }, \";\"), \"\\n  \", mdx(\"span\", {\n    parentName: \"code\",\n    \"className\": \"token keyword\"\n  }, \"float\"), \" humidity \", mdx(\"span\", {\n    parentName: \"code\",\n    \"className\": \"token operator\"\n  }, \"=\"), \" sensor\", mdx(\"span\", {\n    parentName: \"code\",\n    \"className\": \"token punctuation\"\n  }, \".\"), mdx(\"span\", {\n    parentName: \"code\",\n    \"className\": \"token function\"\n  }, \"readHumidity\"), mdx(\"span\", {\n    parentName: \"code\",\n    \"className\": \"token punctuation\"\n  }, \"(\"), mdx(\"span\", {\n    parentName: \"code\",\n    \"className\": \"token punctuation\"\n  }, \")\"), mdx(\"span\", {\n    parentName: \"code\",\n    \"className\": \"token punctuation\"\n  }, \";\"), \"\\n  Serial\", mdx(\"span\", {\n    parentName: \"code\",\n    \"className\": \"token punctuation\"\n  }, \".\"), mdx(\"span\", {\n    parentName: \"code\",\n    \"className\": \"token function\"\n  }, \"print\"), mdx(\"span\", {\n    parentName: \"code\",\n    \"className\": \"token punctuation\"\n  }, \"(\"), \"\\n\\t\\t\", mdx(\"span\", {\n    parentName: \"code\",\n    \"className\": \"token string\"\n  }, \"\\\"\\\\t\\\"\"), \" \", mdx(\"span\", {\n    parentName: \"code\",\n    \"className\": \"token operator\"\n  }, \"+\"), \" \", mdx(\"span\", {\n    parentName: \"code\",\n    \"className\": \"token function\"\n  }, \"String\"), mdx(\"span\", {\n    parentName: \"code\",\n    \"className\": \"token punctuation\"\n  }, \"(\"), \"temperature\", mdx(\"span\", {\n    parentName: \"code\",\n    \"className\": \"token punctuation\"\n  }, \")\"), \" \", mdx(\"span\", {\n    parentName: \"code\",\n    \"className\": \"token operator\"\n  }, \"+\"), \" \", mdx(\"span\", {\n    parentName: \"code\",\n    \"className\": \"token string\"\n  }, \"\\\"\\xB0\\\"\"), \" \", mdx(\"span\", {\n    parentName: \"code\",\n    \"className\": \"token operator\"\n  }, \"+\"), \" symbol \", mdx(\"span\", {\n    parentName: \"code\",\n    \"className\": \"token operator\"\n  }, \"+\"), \"\\n\\t\\t\", mdx(\"span\", {\n    parentName: \"code\",\n    \"className\": \"token string\"\n  }, \"\\\", Relative Humidity \\\"\"), \" \", mdx(\"span\", {\n    parentName: \"code\",\n    \"className\": \"token operator\"\n  }, \"+\"), \" \", mdx(\"span\", {\n    parentName: \"code\",\n    \"className\": \"token function\"\n  }, \"String\"), mdx(\"span\", {\n    parentName: \"code\",\n    \"className\": \"token punctuation\"\n  }, \"(\"), \"humidity\", mdx(\"span\", {\n    parentName: \"code\",\n    \"className\": \"token punctuation\"\n  }, \")\"), \" \", mdx(\"span\", {\n    parentName: \"code\",\n    \"className\": \"token operator\"\n  }, \"+\"), \"\\n\\t\\t\", mdx(\"span\", {\n    parentName: \"code\",\n    \"className\": \"token string\"\n  }, \"\\\"% \\\\n\\\"\"), mdx(\"span\", {\n    parentName: \"code\",\n    \"className\": \"token punctuation\"\n  }, \")\"), mdx(\"span\", {\n    parentName: \"code\",\n    \"className\": \"token punctuation\"\n  }, \";\"), \"\\n  \\n  \", mdx(\"span\", {\n    parentName: \"code\",\n    \"className\": \"token comment\"\n  }, \"// Write out to LCD\"), \"\\n  \", mdx(\"span\", {\n    parentName: \"code\",\n    \"className\": \"token function\"\n  }, \"lcdWrite\"), mdx(\"span\", {\n    parentName: \"code\",\n    \"className\": \"token punctuation\"\n  }, \"(\"), mdx(\"span\", {\n    parentName: \"code\",\n    \"className\": \"token number\"\n  }, \"0\"), mdx(\"span\", {\n    parentName: \"code\",\n    \"className\": \"token punctuation\"\n  }, \",\"), \" \", mdx(\"span\", {\n    parentName: \"code\",\n    \"className\": \"token string\"\n  }, \"\\\"Temp:   \\\"\"), \" \", mdx(\"span\", {\n    parentName: \"code\",\n    \"className\": \"token operator\"\n  }, \"+\"), \" \", mdx(\"span\", {\n    parentName: \"code\",\n    \"className\": \"token function\"\n  }, \"String\"), mdx(\"span\", {\n    parentName: \"code\",\n    \"className\": \"token punctuation\"\n  }, \"(\"), \"temperature\", mdx(\"span\", {\n    parentName: \"code\",\n    \"className\": \"token punctuation\"\n  }, \")\"), \" \", mdx(\"span\", {\n    parentName: \"code\",\n    \"className\": \"token operator\"\n  }, \"+\"), \" symbol\", mdx(\"span\", {\n    parentName: \"code\",\n    \"className\": \"token punctuation\"\n  }, \")\"), mdx(\"span\", {\n    parentName: \"code\",\n    \"className\": \"token punctuation\"\n  }, \";\"), \"\\n  \", mdx(\"span\", {\n    parentName: \"code\",\n    \"className\": \"token function\"\n  }, \"lcdWrite\"), mdx(\"span\", {\n    parentName: \"code\",\n    \"className\": \"token punctuation\"\n  }, \"(\"), mdx(\"span\", {\n    parentName: \"code\",\n    \"className\": \"token number\"\n  }, \"1\"), mdx(\"span\", {\n    parentName: \"code\",\n    \"className\": \"token punctuation\"\n  }, \",\"), \" \", mdx(\"span\", {\n    parentName: \"code\",\n    \"className\": \"token string\"\n  }, \"\\\"Target: \\\"\"), \" \", mdx(\"span\", {\n    parentName: \"code\",\n    \"className\": \"token operator\"\n  }, \"+\"), \" \", mdx(\"span\", {\n    parentName: \"code\",\n    \"className\": \"token function\"\n  }, \"String\"), mdx(\"span\", {\n    parentName: \"code\",\n    \"className\": \"token punctuation\"\n  }, \"(\"), \"target\", mdx(\"span\", {\n    parentName: \"code\",\n    \"className\": \"token punctuation\"\n  }, \")\"), \" \", mdx(\"span\", {\n    parentName: \"code\",\n    \"className\": \"token operator\"\n  }, \"+\"), \" \", mdx(\"span\", {\n    parentName: \"code\",\n    \"className\": \"token string\"\n  }, \"\\\".00\\\"\"), \" \", mdx(\"span\", {\n    parentName: \"code\",\n    \"className\": \"token operator\"\n  }, \"+\"), \" symbol\", mdx(\"span\", {\n    parentName: \"code\",\n    \"className\": \"token punctuation\"\n  }, \")\"), mdx(\"span\", {\n    parentName: \"code\",\n    \"className\": \"token punctuation\"\n  }, \";\"), \"\\n\\n  \", mdx(\"span\", {\n    parentName: \"code\",\n    \"className\": \"token comment\"\n  }, \"// Activate Temperature Control\"), \"\\n  \", mdx(\"span\", {\n    parentName: \"code\",\n    \"className\": \"token keyword\"\n  }, \"if\"), mdx(\"span\", {\n    parentName: \"code\",\n    \"className\": \"token punctuation\"\n  }, \"(\"), mdx(\"span\", {\n    parentName: \"code\",\n    \"className\": \"token function\"\n  }, \"round\"), mdx(\"span\", {\n    parentName: \"code\",\n    \"className\": \"token punctuation\"\n  }, \"(\"), \"target\", mdx(\"span\", {\n    parentName: \"code\",\n    \"className\": \"token punctuation\"\n  }, \")\"), \" \", mdx(\"span\", {\n    parentName: \"code\",\n    \"className\": \"token operator\"\n  }, \">\"), \" \", mdx(\"span\", {\n    parentName: \"code\",\n    \"className\": \"token function\"\n  }, \"round\"), mdx(\"span\", {\n    parentName: \"code\",\n    \"className\": \"token punctuation\"\n  }, \"(\"), \"temperature\", mdx(\"span\", {\n    parentName: \"code\",\n    \"className\": \"token punctuation\"\n  }, \")\"), mdx(\"span\", {\n    parentName: \"code\",\n    \"className\": \"token punctuation\"\n  }, \")\"), \" \", mdx(\"span\", {\n    parentName: \"code\",\n    \"className\": \"token function\"\n  }, \"digitalWrite\"), mdx(\"span\", {\n    parentName: \"code\",\n    \"className\": \"token punctuation\"\n  }, \"(\"), \"HEATER_PIN\", mdx(\"span\", {\n    parentName: \"code\",\n    \"className\": \"token punctuation\"\n  }, \",\"), \" HIGH\", mdx(\"span\", {\n    parentName: \"code\",\n    \"className\": \"token punctuation\"\n  }, \")\"), mdx(\"span\", {\n    parentName: \"code\",\n    \"className\": \"token punctuation\"\n  }, \";\"), \"\\n  \", mdx(\"span\", {\n    parentName: \"code\",\n    \"className\": \"token keyword\"\n  }, \"else\"), \" \", mdx(\"span\", {\n    parentName: \"code\",\n    \"className\": \"token function\"\n  }, \"digitalWrite\"), mdx(\"span\", {\n    parentName: \"code\",\n    \"className\": \"token punctuation\"\n  }, \"(\"), \"HEATER_PIN\", mdx(\"span\", {\n    parentName: \"code\",\n    \"className\": \"token punctuation\"\n  }, \",\"), \" LOW\", mdx(\"span\", {\n    parentName: \"code\",\n    \"className\": \"token punctuation\"\n  }, \")\"), mdx(\"span\", {\n    parentName: \"code\",\n    \"className\": \"token punctuation\"\n  }, \";\"), \"\\n\\n  \", mdx(\"span\", {\n    parentName: \"code\",\n    \"className\": \"token keyword\"\n  }, \"if\"), mdx(\"span\", {\n    parentName: \"code\",\n    \"className\": \"token punctuation\"\n  }, \"(\"), mdx(\"span\", {\n    parentName: \"code\",\n    \"className\": \"token function\"\n  }, \"round\"), mdx(\"span\", {\n    parentName: \"code\",\n    \"className\": \"token punctuation\"\n  }, \"(\"), \"target\", mdx(\"span\", {\n    parentName: \"code\",\n    \"className\": \"token punctuation\"\n  }, \")\"), \" \", mdx(\"span\", {\n    parentName: \"code\",\n    \"className\": \"token operator\"\n  }, \"<\"), \" \", mdx(\"span\", {\n    parentName: \"code\",\n    \"className\": \"token function\"\n  }, \"round\"), mdx(\"span\", {\n    parentName: \"code\",\n    \"className\": \"token punctuation\"\n  }, \"(\"), \"temperature\", mdx(\"span\", {\n    parentName: \"code\",\n    \"className\": \"token punctuation\"\n  }, \")\"), mdx(\"span\", {\n    parentName: \"code\",\n    \"className\": \"token punctuation\"\n  }, \")\"), \" \", mdx(\"span\", {\n    parentName: \"code\",\n    \"className\": \"token function\"\n  }, \"digitalWrite\"), mdx(\"span\", {\n    parentName: \"code\",\n    \"className\": \"token punctuation\"\n  }, \"(\"), \"COOLER_PIN\", mdx(\"span\", {\n    parentName: \"code\",\n    \"className\": \"token punctuation\"\n  }, \",\"), \" HIGH\", mdx(\"span\", {\n    parentName: \"code\",\n    \"className\": \"token punctuation\"\n  }, \")\"), mdx(\"span\", {\n    parentName: \"code\",\n    \"className\": \"token punctuation\"\n  }, \";\"), \"\\n  \", mdx(\"span\", {\n    parentName: \"code\",\n    \"className\": \"token keyword\"\n  }, \"else\"), \" \", mdx(\"span\", {\n    parentName: \"code\",\n    \"className\": \"token function\"\n  }, \"digitalWrite\"), mdx(\"span\", {\n    parentName: \"code\",\n    \"className\": \"token punctuation\"\n  }, \"(\"), \"COOLER_PIN\", mdx(\"span\", {\n    parentName: \"code\",\n    \"className\": \"token punctuation\"\n  }, \",\"), \" LOW\", mdx(\"span\", {\n    parentName: \"code\",\n    \"className\": \"token punctuation\"\n  }, \")\"), mdx(\"span\", {\n    parentName: \"code\",\n    \"className\": \"token punctuation\"\n  }, \";\"), \"\\n\\n  \", mdx(\"span\", {\n    parentName: \"code\",\n    \"className\": \"token comment\"\n  }, \"// Pause to allow finger to lift from button(s)\"), \"\\n  \", mdx(\"span\", {\n    parentName: \"code\",\n    \"className\": \"token keyword\"\n  }, \"if\"), mdx(\"span\", {\n    parentName: \"code\",\n    \"className\": \"token punctuation\"\n  }, \"(\"), \"wait\", mdx(\"span\", {\n    parentName: \"code\",\n    \"className\": \"token punctuation\"\n  }, \")\"), \" \", mdx(\"span\", {\n    parentName: \"code\",\n    \"className\": \"token function\"\n  }, \"delay\"), mdx(\"span\", {\n    parentName: \"code\",\n    \"className\": \"token punctuation\"\n  }, \"(\"), mdx(\"span\", {\n    parentName: \"code\",\n    \"className\": \"token number\"\n  }, \"500\"), mdx(\"span\", {\n    parentName: \"code\",\n    \"className\": \"token punctuation\"\n  }, \")\"), mdx(\"span\", {\n    parentName: \"code\",\n    \"className\": \"token punctuation\"\n  }, \";\"), \"\\n\", mdx(\"span\", {\n    parentName: \"code\",\n    \"className\": \"token punctuation\"\n  }, \"}\"), \"\\n\\n\", mdx(\"span\", {\n    parentName: \"code\",\n    \"className\": \"token comment\"\n  }, \"// Utility to simplify writing to LCD\"), \"\\n\", mdx(\"span\", {\n    parentName: \"code\",\n    \"className\": \"token keyword\"\n  }, \"void\"), \" \", mdx(\"span\", {\n    parentName: \"code\",\n    \"className\": \"token function\"\n  }, \"lcdWrite\"), mdx(\"span\", {\n    parentName: \"code\",\n    \"className\": \"token punctuation\"\n  }, \"(\"), mdx(\"span\", {\n    parentName: \"code\",\n    \"className\": \"token keyword\"\n  }, \"const\"), \" \", mdx(\"span\", {\n    parentName: \"code\",\n    \"className\": \"token keyword\"\n  }, \"bool\"), \" line\", mdx(\"span\", {\n    parentName: \"code\",\n    \"className\": \"token punctuation\"\n  }, \",\"), \" \", mdx(\"span\", {\n    parentName: \"code\",\n    \"className\": \"token keyword\"\n  }, \"const\"), \" String\", mdx(\"span\", {\n    parentName: \"code\",\n    \"className\": \"token operator\"\n  }, \"&\"), \" text\", mdx(\"span\", {\n    parentName: \"code\",\n    \"className\": \"token punctuation\"\n  }, \")\"), mdx(\"span\", {\n    parentName: \"code\",\n    \"className\": \"token punctuation\"\n  }, \"{\"), \"\\n  lcd\", mdx(\"span\", {\n    parentName: \"code\",\n    \"className\": \"token punctuation\"\n  }, \".\"), mdx(\"span\", {\n    parentName: \"code\",\n    \"className\": \"token function\"\n  }, \"setCursor\"), mdx(\"span\", {\n    parentName: \"code\",\n    \"className\": \"token punctuation\"\n  }, \"(\"), mdx(\"span\", {\n    parentName: \"code\",\n    \"className\": \"token number\"\n  }, \"0\"), mdx(\"span\", {\n    parentName: \"code\",\n    \"className\": \"token punctuation\"\n  }, \",\"), \" line\", mdx(\"span\", {\n    parentName: \"code\",\n    \"className\": \"token punctuation\"\n  }, \")\"), mdx(\"span\", {\n    parentName: \"code\",\n    \"className\": \"token punctuation\"\n  }, \";\"), \"\\n  lcd\", mdx(\"span\", {\n    parentName: \"code\",\n    \"className\": \"token punctuation\"\n  }, \".\"), mdx(\"span\", {\n    parentName: \"code\",\n    \"className\": \"token function\"\n  }, \"print\"), mdx(\"span\", {\n    parentName: \"code\",\n    \"className\": \"token punctuation\"\n  }, \"(\"), \"text\", mdx(\"span\", {\n    parentName: \"code\",\n    \"className\": \"token punctuation\"\n  }, \")\"), mdx(\"span\", {\n    parentName: \"code\",\n    \"className\": \"token punctuation\"\n  }, \";\"), \"\\n\", mdx(\"span\", {\n    parentName: \"code\",\n    \"className\": \"token punctuation\"\n  }, \"}\")))), mdx(\"p\", null, \"Connect the Arduino to you computer and click the \", mdx(\"strong\", {\n    parentName: \"p\"\n  }, \"Upload\"), \" button to deploye the code to the Arduino.\"), mdx(\"h2\", null, \"3. Test it out!\"), mdx(\"p\", null, \"You should be able to view the current temperature, adjust the target temperature up and down, switch between celsius and fahrenheit, adjust the brightness of the LED, and see the heating and cooling functions come on based on the difference between the current and target temperatures.\"), mdx(\"p\", null, \"Here's a video of the thermostat in action:\"), mdx(\"iframe\", {\n    width: \"560\",\n    height: \"315\",\n    src: \"https://www.youtube.com/embed/IbFVXAm5U0U\",\n    frameBorder: \"0\",\n    allow: \"accelerometer; autoplay; clipboard-write; encrypted-media; gyroscope; picture-in-picture\",\n    allowFullScreen: true\n  }), mdx(\"h2\", null, \"Credit\"), mdx(\"p\", null, \"This project is adapted from the \", mdx(\"a\", {\n    parentName: \"p\",\n    \"href\": \"https://www.instructables.com/Arduino-Thermostat/\"\n  }, \"Arduino Thermostat by Micah Beeler\"), \".\"), mdx(\"h2\", null, \"Articles that Helped\"), mdx(\"ul\", null, mdx(\"li\", {\n    parentName: \"ul\"\n  }, mdx(\"a\", {\n    parentName: \"li\",\n    \"href\": \"https://www.circuitbasics.com/how-to-set-up-the-dht11-humidity-sensor-on-an-arduino/\"\n  }, \"How to set up the DHT11 Humidity Sensor on an Arduino\")), mdx(\"li\", {\n    parentName: \"ul\"\n  }, mdx(\"a\", {\n    parentName: \"li\",\n    \"href\": \"https://arduinogetstarted.com/tutorials/arduino-lcd\"\n  }, \"Arduino LCD tutorial\"))));\n}\n;\nMDXContent.isMDXComponent = true;","fields":{"slug":"/arduino-thermostat/"},"frontmatter":{"description":"Build your own programmable thermostat with Arduino","tags":["arduino-uno","arduino-lcd-16x2","relays"],"title":"Arduino Thermostat"}}},"pageContext":{"slug":"/arduino-thermostat/"}},"staticQueryHashes":["1957148337","3794076007","80858887"]}