{"componentChunkName":"component---src-templates-article-tsx","path":"/git/","result":{"data":{"mdx":{"body":"var _excluded = [\"components\"];\nfunction _extends() { _extends = Object.assign ? Object.assign.bind() : function (target) { for (var i = 1; i < arguments.length; i++) { var source = arguments[i]; for (var key in source) { if (Object.prototype.hasOwnProperty.call(source, key)) { target[key] = source[key]; } } } return target; }; return _extends.apply(this, arguments); }\nfunction _objectWithoutProperties(source, excluded) { if (source == null) return {}; var target = _objectWithoutPropertiesLoose(source, excluded); var key, i; if (Object.getOwnPropertySymbols) { var sourceSymbolKeys = Object.getOwnPropertySymbols(source); for (i = 0; i < sourceSymbolKeys.length; i++) { key = sourceSymbolKeys[i]; if (excluded.indexOf(key) >= 0) continue; if (!Object.prototype.propertyIsEnumerable.call(source, key)) continue; target[key] = source[key]; } } return target; }\nfunction _objectWithoutPropertiesLoose(source, excluded) { if (source == null) return {}; var target = {}; var sourceKeys = Object.keys(source); var key, i; for (i = 0; i < sourceKeys.length; i++) { key = sourceKeys[i]; if (excluded.indexOf(key) >= 0) continue; target[key] = source[key]; } return target; }\n/* @jsxRuntime classic */\n/* @jsx mdx */\n\nvar _frontmatter = {\n  \"date\": \"2020-11-17T11:54:30.000Z\",\n  \"description\": \"A distributed version-control system to track changes, typically for software development projects\",\n  \"redirect_from\": [\"/tools/git/\", \"/linus-torvalds\"],\n  \"tags\": [\"cli\", \"open-source-software\", \"version-control\"],\n  \"title\": \"Git\"\n};\nvar layoutProps = {\n  _frontmatter: _frontmatter\n};\nvar MDXLayout = \"wrapper\";\nreturn function MDXContent(_ref) {\n  var components = _ref.components,\n    props = _objectWithoutProperties(_ref, _excluded);\n  return mdx(MDXLayout, _extends({}, layoutProps, props, {\n    components: components,\n    mdxType: \"MDXLayout\"\n  }), mdx(\"h1\", null, \"Git\"), mdx(\"p\", null, mdx(\"strong\", {\n    parentName: \"p\"\n  }, \"Git\"), \" is a free, \", mdx(\"a\", {\n    parentName: \"p\",\n    \"href\": \"../open-source-software/\"\n  }, \"open-source\"), \" \", mdx(\"a\", {\n    parentName: \"p\",\n    \"href\": \"../distributed-systems/\"\n  }, \"distributed\"), \" \", mdx(\"a\", {\n    parentName: \"p\",\n    \"href\": \"../version-control/\"\n  }, \"version control\"), \" system created by Linus Torvalds in 2005 to replace BitKeeper as the version control system for the \", mdx(\"a\", {\n    parentName: \"p\",\n    \"href\": \"../linux/\"\n  }, \"Linux\"), \" kernel. Git is licensed under \", mdx(\"a\", {\n    parentName: \"p\",\n    \"href\": \"https://opensource.org/licenses/gpl-2.0.php\"\n  }, \"GPLv2\"), \" and the code is \", mdx(\"a\", {\n    parentName: \"p\",\n    \"href\": \"https://github.com/git/git\"\n  }, \"downloadable from GitHub\"), \".\"), mdx(\"p\", null, \"As with  many distributed systems, nearly all of actions in Git are additive. Even when you delete a file from a project, it still exists in Git's database - Git \\\"adds\\\" the fact that the file was deleted, rather than actually deleting the file, even though the file will be removed from the working directory.\"), mdx(\"h2\", null, \"Git file states: Modified, staged, committed\"), mdx(\"p\", null, \"Generally speaking, files tracked by a Git repository can be in one of three states:\"), mdx(\"ul\", null, mdx(\"li\", {\n    parentName: \"ul\"\n  }, mdx(\"strong\", {\n    parentName: \"li\"\n  }, \"Modified\"), \": The file in the working directory is different than the file in the repository.\"), mdx(\"li\", {\n    parentName: \"ul\"\n  }, mdx(\"strong\", {\n    parentName: \"li\"\n  }, \"Staged\"), \": The file is in the staging area, but not yet committed to the repository.\"), mdx(\"li\", {\n    parentName: \"ul\"\n  }, mdx(\"strong\", {\n    parentName: \"li\"\n  }, \"Committed\"), \": The file in the working directory matches the file in the repository.\")), mdx(\"p\", null, \"Files are modified simply by working on them and saving them to disk. Git will detect that the file in the working directory is different from the file in the repository. The \", mdx(\"code\", {\n    parentName: \"p\",\n    \"className\": \"language-text\"\n  }, \"git add\"), \" command is used to copy a file to the staging area. The staging area exists to group related sets of changes together into a single commit. The \", mdx(\"code\", {\n    parentName: \"p\",\n    \"className\": \"language-text\"\n  }, \"git commit\"), \" command copies the file to the Git repository.\"), mdx(\"h2\", null, \"Terms Associated with Git\"), mdx(\"ul\", null, mdx(\"li\", {\n    parentName: \"ul\"\n  }, mdx(\"strong\", {\n    parentName: \"li\"\n  }, \"Branch\"), \": A copy of the code that diverges from the main line of development. Branches are used to do work without interfering with other lines of development. When you \\\"check out\\\" a branch, all the code in your \\\"working directory\\\" is replaced with the code from the branch. It's easy to switch back and forth between branches in git, so you don't have to worry about losing any work.\"), mdx(\"li\", {\n    parentName: \"ul\"\n  }, mdx(\"strong\", {\n    parentName: \"li\"\n  }, \"Check out\"), \": When you switch from one branch to another.\"), mdx(\"li\", {\n    parentName: \"ul\"\n  }, mdx(\"strong\", {\n    parentName: \"li\"\n  }, \"Commit\"), \": When you record a related set of changes in the repository.\"), mdx(\"li\", {\n    parentName: \"ul\"\n  }, mdx(\"strong\", {\n    parentName: \"li\"\n  }, \"Clone\"), \": The creation of a copy of an existing Git repository. When you clone a repository, you don't just get the latest code - you get a full copy of virtually all of the data that the remote repository has, including every version of every file for the history of the project.\"), mdx(\"li\", {\n    parentName: \"ul\"\n  }, mdx(\"strong\", {\n    parentName: \"li\"\n  }, \"Fork\"), \": Similar to a clone, a fork is a copy of a repository used as an upstream. You'll typically create a fork if you don't have permission to modify the original repository - instead, you create a \\\"fork\\\" of the repository so that you have permission to modify it. The fork can then be used to propose changes to the original repository (this is one of the \\\"magical\\\" features of Git that make it so great for open source).\"), mdx(\"li\", {\n    parentName: \"ul\"\n  }, mdx(\"strong\", {\n    parentName: \"li\"\n  }, \"Origin\"), \": An alias on your system for a particular remote repository that makes it easy to refer to. \\\"Origin\\\" is the default alias, created when you clone a repository.\"), mdx(\"li\", {\n    parentName: \"ul\"\n  }, mdx(\"strong\", {\n    parentName: \"li\"\n  }, \"Pull\"), \": When you download changes from a remote repository to your local repository.\"), mdx(\"li\", {\n    parentName: \"ul\"\n  }, mdx(\"strong\", {\n    parentName: \"li\"\n  }, \"Push\"), \": When you upload changes in your local git repository to a remote repository (usually the \\\"origin\\\").\"), mdx(\"li\", {\n    parentName: \"ul\"\n  }, mdx(\"strong\", {\n    parentName: \"li\"\n  }, \"Repository\"), \": A Git database that contains the complete history of your code.\"), mdx(\"li\", {\n    parentName: \"ul\"\n  }, mdx(\"strong\", {\n    parentName: \"li\"\n  }, \"Tag\"), \": The same as a branch, but essentially read-only.\"), mdx(\"li\", {\n    parentName: \"ul\"\n  }, mdx(\"strong\", {\n    parentName: \"li\"\n  }, \"Merge\"), \": A strategy to integrate changes from one branch to another where two separate histories are \\\"combined\\\" via a special type of commit (called a merge commit).\"), mdx(\"li\", {\n    parentName: \"ul\"\n  }, mdx(\"strong\", {\n    parentName: \"li\"\n  }, \"Rebase\"), \": A strategy to integrating changes from one branch to another where the history of the target branch is changed so that it appears to have \\\"started\\\" from the most recent commit in the source branch.\"), mdx(\"li\", {\n    parentName: \"ul\"\n  }, mdx(\"strong\", {\n    parentName: \"li\"\n  }, \"Pull request\"), \" / \", mdx(\"strong\", {\n    parentName: \"li\"\n  }, \"merge request\"), \": Not actually part of Git! This is a feature of most git hosting platforms (GitHub, GitLab, BitBucket) where a merge is proposed and collaborated on.\")), mdx(\"h2\", null, \"Additional Resources for Git\"), mdx(\"ul\", null, mdx(\"li\", {\n    parentName: \"ul\"\n  }, mdx(\"a\", {\n    parentName: \"li\",\n    \"href\": \"https://www.git-scm.com/\"\n  }, \"Official Git Website\")), mdx(\"li\", {\n    parentName: \"ul\"\n  }, mdx(\"a\", {\n    parentName: \"li\",\n    \"href\": \"https://www.git-scm.com/docs/gittutorial\"\n  }, \"Git Tutorial\")), mdx(\"li\", {\n    parentName: \"ul\"\n  }, mdx(\"a\", {\n    parentName: \"li\",\n    \"href\": \"https://git-scm.com/book/en/v2\"\n  }, \"Pro Git (Book)\"))));\n}\n;\nMDXContent.isMDXComponent = true;","fields":{"slug":"/git/"},"frontmatter":{"description":"A distributed version-control system to track changes, typically for software development projects","tags":["cli","open-source-software","version-control"],"title":"Git"}}},"pageContext":{"slug":"/git/"}},"staticQueryHashes":["3772659826","3794076007","80858887"]}